course_id,subject,order_index
751,"reflecting on your work, and transitioning in and out of communities; and",4
751,effectively managing community-engaged projects,5
752,Describe a relational database and explain relational database concepts.,1
752,Design the schema of a relational database.,2
752,"Create database objects such as tables, keys, constraints, and views.",3
752,Load tables with data from .CSV files.,4
752,"Demonstrate working knowledge of MySQL, PostgreSQL and IBM Db2.",5
754,How to produce and record your own music,1
754,"History, theory and practice of music technology",2
754,"Sound, audio, MIDI, effects and sequencing",3
754,Hands-on practice with music-making using contemporary digital tools,4
755,"Thescale, scope, and challenges in achieving the SDG 6, safe access to water for all.",1
755,The issues ofclimate changeand its influence on water.,2
755,"Water and sanitationfor health, thefood, energy and water nexus.",3
755,"Theenvironmental, economic and social dimensionsof SDG 6 and the critical role ofwater governance.",4
755,Thetransboundary cooperationneeded to achieve the goal on water.,5
755,Lessons from concrete practices around the world through a series ofcase studies.,6
756,Understand the various theories of economics with regards to Keynesian and Classical.,1
756,Interpret how the various components of economics likeInflation play a major role in the growth of an economy.,2
756,"Understand the circular flow of income and and the determinants of its various components like savings, consumption and investment.",3
756,Deduce the importance of monetary and fiscal policies and how it affects the developed and developing countries.,4
757,The Japanese management ecosystem,1
757,"The keys to Japan's rise, current business status,and future",2
757,"Case studies on Toyota, Nissan, Honda, Recruit, and Softbank",3
759,Current challenges and opportunities in resource resilience,1
759,Environmental problems caused by waste mismanagement of products that contain CRMs,2
759,Waste collection methods and efficient collection of waste in households and at companies,3
759,"Remanufacturing, refurbishment, re-use and recycling processes of products which contain CRMs",4
759,Waste prevention through chain optimization,5
759,Benefits of circular procurement to keep critical raw materials in the loop through smart waste management,6
759,How product design can support efficient recycling and remanufacturing,7
759,How to uncover new business models to reduce waste and to make your business more resource resilient,8
760,Situate on a timeline the key dates of Unix and Linux creation,1
760,Use basic commands to control the Linux Operating System,2
760,Navigate and manipulate the Linux Filesystem using the command line interface,3
760,Manage the memory and processes running on Linux,4
760,Compile and execute a C program on Linux,5
763,"The scale, scope, and establishment of the Sustainable Development Goals",1
763,The societal transformations required to meet the SDGs,2
763,"The governance, planning, and financing essential for progress",3
763,The role of civil society and the business sector in advancing global development,4
763,The types of transboundary cooperation needed to achieve global goals,5
771,Apply the clustering techniques to find clusters within the data,1
771,Use the classification techniques to conduct classification and predication,2
771,Use the knowledge of frequest pattern mining to discover patterns from the data,3
771,Learn data warehouse techniques for data analysis,4
772,Evaluate and discuss the knowledge and theories of managing human resources applicable to the hotel and tourism industry,1
772,Appraise and analyze human resources functions and employee motivation in the context of the hotel and tourism environment,2
772,Evaluate the impacts and factors that affect the development of organizational culture,3
772,"Assess the relationship between the hotel and tourism industry and their society; and evaluate the impacts of social, economical, and cultural factors on managing human resources",4
772,Analyze and evaluate HR research journals to identify applicable methodologies,5
772,"Identify human resources problems within the hotel and tourism context, and apply research skills and techniques to solve these problems",6
772,"Analyze and appraise related numerical and graphical data regarding managing human resources, and develop solutions for industry practitioners.",7
773,Explore the role of minerals in society and their contribution to sustainable development.,1
773,Investigate the current issues and challenges confronting the sector.,2
773,Understand the importance of environmental social and governance (ESG) aspects of mining operations.,3
773,Find out about new frameworks and policies for resource developments in the 21st century.,4
775,The Anthropocene: what it is and why it matters,1
775,Tipping points: the big three boundaries of the planet,2
775,Resilience thinking: understanding the social-ecological implications of sustainability,3
775,Global governance: how do we move forward as a planet for sustainability?,4
776,Methods for the valuation of landscapes using the ecosystem service paradigm,1
776,How to quantify landscape attributes using landscape metrics,2
776,Methods to assess user conflicts in ecologically sensitive landscapes,3
776,How to use satellite data to detect landscape changes,4
776,"Philosophical aspects of landscapes, land ethics and conservation",5
776,Theories of landscape perception and place attachment,6
776,Ecology in the context of urban landscapes,7
776,Statistical analysis with R,8
776,How to work with spatial data and GIS,9
777,Learn how effective leadership and its principles positively influences the crisis management process.,1
777,Learn about the significance of communication from leadership in a disaster.,2
777,Learn about the risk finances present in a crisis.,3
777,"Learn about the post-crisis assessment, and develop resiliency techniques for your organization.",4
777,"Learn about the implications of a crisis on infrastructure, community, the workforce and finances.",5
777,Learn about the process that should follow a disaster to ensure hazard mitigation in the future.,6
778,What is Digital Asset Management,1
778,What is a Digital Asset,2
778,Understanding your Organization’s Digital Assets and their lifecycle,3
778,Using Workflows in a Digital Asset Management System,4
778,Understanding User Needs in your organization,5
778,Making the case for DAM: Return on Investment,6
778,Options for DAM software,7
779,CS50's Introduction to Computer ScienceHarvardX,1
779,Course,2
779,Artificial Intelligence: Implications for Business StrategyMIT Sloan School of Management,3
779,Executive Education,4
779,Supply Chain DesignMITx,5
779,Course,6
779,Data Structures & Algorithms IVGTx,7
779,Course,8
779,Exercising Leadership: Foundational PrinciplesHarvardX,9
779,Course,10
779,Learn Software Engineering,11
779,Learn Blockchain,12
779,Learn Computer Programming,13
779,Learn Architecture,14
779,Learn Project Management,15
779,Learn Business Administration,16
779,Become a Cybersecurity Analyst,17
779,Become a Data Scientist,18
779,Become a Social Media Manager,19
779,Become a Software Developer,20
781,"Describe Big Data, its impact, processing methods and tools, and use cases.",1
781,"Describe Hadoop architecture, ecosystem, practices, and applications, including Distributed File System (HDFS), HBase, Spark, and MapReduce.",2
781,"Describe Spark programming basics, including parallel programming basics, for DataFrames, data sets, and SparkSQL.",3
781,"Describe how Spark uses RDDs,creates data sets, and uses Catalyst and Tungsten to optimize SparkSQL.",4
781,Apply Apache Spark development and runtime environment options.,5
783,Getting to know the specifics of biotech entrepreneurship,1
783,Assessing the business potential through qualitative and quantitative approaches,2
783,Understanding the business model concept and evaluating specific biotech business models,3
783,Planning your next steps to bring a biotech innovation to the market,4
783,Defining a business strategy to reach your vision,5
784,"Present data using some of the data visualization libraries in Python, including Matplotlib, Seaborn, and Folium",1
784,"Use basic visualization tools, including area plots, histograms, and bar charts",2
784,"Use specialized visualization tools, including pie charts, box plots, scatter plots, and bubble plots",3
784,"Utilize advanced visualization tools, including waffle charts, word clouds and regression plots",4
784,Plot data on maps and visualize geospatial data,5
786,perform physical simulations of real-life situations that are expressed mathematically,1
786,manipulate and animate static people so that they have realistic motions,2
786,make digitized people interact with 3D objects,3
786,"apply your skills in a wide variety of applications such as manufacturing, robotics, movies, games, toys, and many others",4
787,Analyze different communication styles as well as their strengths and weaknesses and when they are appropriate to use,1
787,Build and maintain trust with your co-workers and increase your influence and eminence in the workplace,2
787,Identify ways to approach and mediate workplace conflicts,3
787,Demonstrate active listening skills to enhance your understanding of workplace issues,4
788,Basic forecasting methods,1
788,Lot sizing methods,2
788,Safety stock calculations,3
788,Differentiation techniques,4
788,Material and Capacity planning,5
788,Transport Planning,6
788,Logistics aspect on procurement,7
788,Basics in Sales and Operations planning,8
788,Master production scheduling,9
793,CS50's Introduction to Computer ScienceHarvardX,1
793,Course,2
793,Artificial Intelligence: Implications for Business StrategyMIT Sloan School of Management,3
793,Executive Education,4
793,Supply Chain DesignMITx,5
793,Course,6
793,Data Structures & Algorithms IVGTx,7
793,Course,8
793,Exercising Leadership: Foundational PrinciplesHarvardX,9
793,Course,10
793,KULeuvenX: Wiskunde voor (startende) studenten,11
793,Increase your career opportunities84% of learners report more opportunities after earning their certificate.,12
793,Show off your hard work and dedicationYou’re learning fromKULeuvenX! That’s a big deal. Let others know about your achievements.,13
793,Unlimited Access,14
793,World class institutions,15
793,Graded assessments,16
793,Earn a certificate,17
793,Access Expires Jul 1,18
793,Learn Software Engineering,19
793,Learn Blockchain,20
794,How to generate and evaluate Sales Forecasts,1
794,How to plan and optimize your Inventory Management,2
794,How to think and decide on Product Assortment,3
794,How to find the best prices for your products,4
795,Learn Software Engineering,1
795,Learn Blockchain,2
795,Learn Computer Programming,3
795,Learn Architecture,4
795,Learn Project Management,5
795,Learn Business Administration,6
795,Become a Cybersecurity Analyst,7
795,Become a Data Scientist,8
795,Become a Social Media Manager,9
795,Become a Software Developer,10
795,Become a Software Engineer,11
795,Bachelor's in Business,12
795,Bachelor's in Computer Science / Data Science,13
795,Bachelor's in Health and Nursing,14
795,Bachelor's in Accounting,15
796,CS50's Introduction to Computer ScienceHarvardX,1
796,Course,2
796,Artificial Intelligence: Implications for Business StrategyMIT Sloan School of Management,3
796,Executive Education,4
796,Supply Chain DesignMITx,5
796,Course,6
796,Data Structures & Algorithms IVGTx,7
796,Course,8
796,Exercising Leadership: Foundational PrinciplesHarvardX,9
796,Course,10
796,Learn Software Engineering,11
796,Learn Blockchain,12
796,Learn Computer Programming,13
796,Learn Architecture,14
796,Learn Project Management,15
796,Learn Business Administration,16
796,Become a Cybersecurity Analyst,17
796,Become a Data Scientist,18
796,Become a Social Media Manager,19
796,Become a Software Developer,20
797,The basic steps in a forensic investigation,1
797,Essential forensic engineering methods and techniques,2
797,"How to apply the TU Delft Forensic Engineering mind-set in the fields of Building Engineering, Aeronautical Engineering and Biomechanical Engineering",3
797,Ways to develop a positive attitude and the right mind-set to learn from failures,4
800,Apply techniques to gather and wrangle data from multiple sources.,1
800,"Analyze data to identify patterns, trends, and insights through exploratory techniques.",2
800,Create visual representations of data using Python libraries to communicate findings effectively.,3
800,Construct interactive dashboards with BI tools to present and explore data dynamically.,4
801,Learn Software Engineering,1
801,Learn Blockchain,2
801,Learn Computer Programming,3
801,Learn Architecture,4
801,Learn Project Management,5
801,Learn Business Administration,6
801,Become a Cybersecurity Analyst,7
801,Become a Data Scientist,8
801,Become a Social Media Manager,9
801,Become a Software Developer,10
801,Become a Software Engineer,11
801,Bachelor's in Business,12
801,Bachelor's in Computer Science / Data Science,13
801,Bachelor's in Health and Nursing,14
801,Bachelor's in Accounting,15
802,Learn Software Engineering,1
802,Learn Blockchain,2
802,Learn Computer Programming,3
802,Learn Architecture,4
802,Learn Project Management,5
802,Learn Business Administration,6
802,Become a Cybersecurity Analyst,7
802,Become a Data Scientist,8
802,Become a Social Media Manager,9
802,Become a Software Developer,10
802,Become a Software Engineer,11
802,Bachelor's in Business,12
802,Bachelor's in Computer Science / Data Science,13
802,Bachelor's in Health and Nursing,14
802,Bachelor's in Accounting,15
803,Finite automata and regular expressions,1
803,Context-free grammars,2
803,Turing machines and decidability,3
803,"The theory of intractability, or NP-complete problems",4
804,How countries translate natural resource wealth into sustainable development outcomes,1
804,How governance of extractive industries impact long term economic development,2
804,The policies necessary for the sustainable management of natural resource wealth,3
804,"Why communication between government, industry, and citizensis critical to sustainable natural resource management",4
806,Analyze and model situations of divergence and conflict,1
806,Adopt a critical posture regarding oneself and others’ conflict styles,2
806,Get acquainted with various conflict management strategies,3
807,CS50's Introduction to Computer ScienceHarvardX,1
807,Course,2
807,Artificial Intelligence: Implications for Business StrategyMIT Sloan School of Management,3
807,Executive Education,4
807,Supply Chain DesignMITx,5
807,Course,6
807,Data Structures & Algorithms IVGTx,7
807,Course,8
807,Exercising Leadership: Foundational PrinciplesHarvardX,9
807,Course,10
807,logycaX: Logistics Fundamentals,11
807,Increase your career opportunities84% of learners report more opportunities after earning their certificate.,12
807,Show off your hard work and dedicationYou’re learning fromlogycaX! That’s a big deal. Let others know about your achievements.,13
807,Unlimited Access,14
807,World class institutions,15
807,Graded assessments,16
807,Earn a certificate,17
807,Access Expires Jun 24,18
807,Learn Software Engineering,19
807,Learn Blockchain,20
808,"Describe and differntiate between Extract, Transform, Load (ETL) and Extract, Load, Transform (ELT) processes",1
808,"Define data pipeline components, processes, tools and technologies",2
808,Create ETL processes using Bash shell scripts,3
808,Develop batch data pipelines using Apache Airflow,4
808,Create streaming data pipelines using Apache Kafka,5
813,Learn Software Engineering,1
813,Learn Blockchain,2
813,Learn Computer Programming,3
813,Learn Architecture,4
813,Learn Project Management,5
813,Learn Business Administration,6
813,Become a Cybersecurity Analyst,7
813,Become a Data Scientist,8
813,Become a Social Media Manager,9
813,Become a Software Developer,10
813,Become a Software Engineer,11
813,Bachelor's in Business,12
813,Bachelor's in Computer Science / Data Science,13
813,Bachelor's in Health and Nursing,14
813,Bachelor's in Accounting,15
824,Learn Software Engineering,1
824,Learn Blockchain,2
824,Learn Computer Programming,3
824,Learn Architecture,4
824,Learn Project Management,5
824,Learn Business Administration,6
824,Become a Cybersecurity Analyst,7
824,Become a Data Scientist,8
824,Become a Social Media Manager,9
824,Become a Software Developer,10
824,Become a Software Engineer,11
824,Bachelor's in Business,12
824,Bachelor's in Computer Science / Data Science,13
824,Bachelor's in Health and Nursing,14
824,Bachelor's in Accounting,15
825,Understand the links between nature and politics,1
825,Learn the significance of universal organisations vs local power structures,2
825,Explore how a complex equilibrium that aims at a sustainable future for humanity might be achieved,3
826,What exactly navigation is and how it works,1
826,"The importance of position, direction, and speed",2
826,The many navigational tools of the 18th century,3
826,How the motion of the sun and stars aids navigation,4
826,Why longitude is so difficult to determine,5
826,The historical context of navigation’s technical advances,6
826,The role of chronometers and lunar distance,7
826,The story of John Harrison and The Longitude Prize,8
830,Algebra and arithmetic,1
830,Basic vocabulary for sets of real numbers,2
830,Basic concepts of functions,3
830,Understanding and graphing polynomials,4
830,Mathematical problem solving,5
833,"How the field has developed and shifted over time, and how recent developments like advanced technology impact farming.",1
833,"What is food security? How do poverty, inequality and other factors affect the nutrition of not just individuals, but entire countries?",2
833,"All about regulations influencing production, trade and other aspects of agriculture.",3
833,"Examples from industries ranging from rice to livestock, and the experiences of smallholder farmers.",4
838,CS50's Introduction to Computer ScienceHarvardX,1
838,Course,2
838,Artificial Intelligence: Implications for Business StrategyMIT Sloan School of Management,3
838,Executive Education,4
838,Supply Chain DesignMITx,5
838,Course,6
838,Data Structures & Algorithms IVGTx,7
838,Course,8
838,Exercising Leadership: Foundational PrinciplesHarvardX,9
838,Course,10
838,Affordable & flexible,11
838,Undergraduate-level,12
838,Career advancement,13
838,In-demand career skills,14
838,Life-long learning,15
838,Learn Software Engineering,16
838,Learn Blockchain,17
838,Learn Computer Programming,18
838,Learn Architecture,19
838,Learn Project Management,20
839,Determine the most appropriate negotiation strategy to employ in different scenarios.,1
839,Identify the most appropriate anchoring topics and concessions to achieve a desired outcome in a negotiation.,2
839,Choose appropriate methods for creating win-win value by integration.,3
839,Apply the principles of strategic negotiation to an upcoming negotiation.,4
841,The principles behind the potential loss mechanisms in photovoltaic devices,1
841,The semiconductor physics necessary to understand solar cell performance and engineering,2
841,The optics and light management tools necessary for optimal solar cell design,3
841,"To model all aspects of a working solar cell, understanding the efficiency limits and design rules",4
842,CS50's Introduction to Computer ScienceHarvardX,1
842,Course,2
842,Artificial Intelligence: Implications for Business StrategyMIT Sloan School of Management,3
842,Executive Education,4
842,Supply Chain DesignMITx,5
842,Course,6
842,Data Structures & Algorithms IVGTx,7
842,Course,8
842,Exercising Leadership: Foundational PrinciplesHarvardX,9
842,Course,10
842,Learn Software Engineering,11
842,Learn Blockchain,12
842,Learn Computer Programming,13
842,Learn Architecture,14
842,Learn Project Management,15
842,Learn Business Administration,16
842,Become a Cybersecurity Analyst,17
842,Become a Data Scientist,18
842,Become a Social Media Manager,19
842,Become a Software Developer,20
843,"Learn how to define healthy levels of blood pressure, cholesterol and blood sugar levels",1
843,Learn how to examine the pathophysiology of metabolic risks and their effects on coronary artery disease,2
843,"Learn how to determine the presence of hypertension, lipid disorders, and diabetes in an individual.",3
844,How to select the correct fabrication process for a specific micro-device or microsystem,1
844,Establish the workflow for the cleanroom processes,2
844,Identify how physical and chemical phenomena govern miniaturized systems for various applications,3
844,Resource planning for a given microsystem fabrication,4
845,CS50's Introduction to Computer ScienceHarvardX,1
845,Course,2
845,Artificial Intelligence: Implications for Business StrategyMIT Sloan School of Management,3
845,Executive Education,4
845,Supply Chain DesignMITx,5
845,Course,6
845,Data Structures & Algorithms IVGTx,7
845,Course,8
845,Exercising Leadership: Foundational PrinciplesHarvardX,9
845,Course,10
845,UCR: Human Resources: Acquiring and Managing Talent in the 21st Century,11
845,Increase your career opportunities84% of learners report more opportunities after earning their certificate.,12
845,Show off your hard work and dedicationYou’re learning fromUCR! That’s a big deal. Let others know about your achievements.,13
845,Unlimited Access,14
845,World class institutions,15
845,Graded assessments,16
845,Earn a certificate,17
845,Access Expires Jul 15,18
845,Learn Software Engineering,19
845,Learn Blockchain,20
846,Conceptualize how lifestyle behaviors resulted in chronic disease in the US,1
846,Chronic disease epidemic affects our economic health as a nation.,2
846,What is Lifestyle Medicine and its differences from traditional Western medicine.,3
846,"Tools to develop a personal, healthy lifestyle",4
846,Lifestyle factors contribution to leading health killers in the US,5
846,"Health relationships between food production, politics, economics and the environment",6
846,Commit to improvement in personal health choices,7
847,"Specialised knowledge of histories, forms, and traditions of writing for digital performance as well as the cultural contexts of innovative practitioners and practices within digital performance; of contemporary critical, analytical, and narrative theories of digital media and performance;",1
847,"detailed understanding of key performance components within the discipline, to include: ideational sources, body, space, image, sound, text, movement, environment.",2
847,dramaturgical and script-editing skills within digital and radio scripts,3
847,"developed advanced self-management skills to include working in planned and improvisatory ways, as well as the ability to anticipate and accommodate change, ambiguity, creative risk-taking, uncertainty and unfamiliarity;",4
847,how to create effective structure within a scene; how to edit your script; how to create effective characters within online narratives.,5
848,CS50's Introduction to Computer ScienceHarvardX,1
848,Course,2
848,Artificial Intelligence: Implications for Business StrategyMIT Sloan School of Management,3
848,Executive Education,4
848,Supply Chain DesignMITx,5
848,Course,6
848,Data Structures & Algorithms IVGTx,7
848,Course,8
848,Exercising Leadership: Foundational PrinciplesHarvardX,9
848,Course,10
848,ETHx: Worldviews - From Sustainability to Regeneration,11
848,Increase your career opportunities84% of learners report more opportunities after earning their certificate.,12
848,Show off your hard work and dedicationYou’re learning fromETHx! That’s a big deal. Let others know about your achievements.,13
848,"be curious to expand from your own expertise and life situation and open for new thinking, philosophical discourse, designerly practice, and real-world infusion.",14
848,"come with interest and motivation to find your role in contributing to a more sustainable and regenerative world, in various ways.",15
848,"be willing to enact within the region you live in, physically, and actively connect with various stakeholders.",16
848,"be open to challenge yourself: mentally, physically, socially.",17
848,Unlimited Access,18
848,World class institutions,19
848,Graded assessments,20
849,Learn how to use Influencer marketing and create the best strategy to approach your customer.,1
849,Understand the importance of your brand in the digital ecosystem.,2
849,Learn about the SEO Fundamentals.,3
849,Analyze data curated from your social media strategies.,4
849,Learn about UI/UX point of view.,5
850,Identify concepts in sport analytics.,1
850,Understand the benefits and objectives of sport analytics.,2
850,Discuss the impact of analytics on sport.,3
850,Demonstrate insight on the strategies and concepts of sport analytics.,4
853,CS50's Introduction to Computer ScienceHarvardX,1
853,Course,2
853,Artificial Intelligence: Implications for Business StrategyMIT Sloan School of Management,3
853,Executive Education,4
853,Supply Chain DesignMITx,5
853,Course,6
853,Data Structures & Algorithms IVGTx,7
853,Course,8
853,Exercising Leadership: Foundational PrinciplesHarvardX,9
853,Course,10
853,EdinburghX: Breeding Programme Modelling with AlphaSimR,11
853,Increase your career opportunities84% of learners report more opportunities after earning their certificate.,12
853,Show off your hard work and dedicationYou’re learning fromEdinburghX! That’s a big deal. Let others know about your achievements.,13
853,Unlimited Access,14
853,World class institutions,15
853,Graded assessments,16
853,Earn a certificate,17
853,Access Expires Jun 24,18
853,Learn Software Engineering,19
853,Learn Blockchain,20
854,How and why microbiome data are collected,1
854,How to extract species and function counts from sequencing data,2
854,"The definitions of richness, evenness and diversity",3
