course_id,subject,order_index
412,To explain the importance of Total Productive Maintenance and the widely-used metric Overall Equipment Effectiveness.,5
412,To understand the difference between push- and pull-systems and how the implementation of pull-systems reduces waste.,6
412,"To apply elements of Lean production including Heijunka, Kanban, Jidoka, and Poka Yoke.",7
412,To apply the 5S methodology for establishing and sustaining a productive work environment.,8
413,Desarrollar un estilo de liderazgo que se adapte a tus fortalezas y las necesidades de la situación,1
413,Diseñar tareas motivadoras y efectivas para ti y para otros,2
413,Comunicar tu perspectiva a otros de una manera creíble y persuasiva,3
416,"Gain insights on the biology of the malaria parasite, the mosquito vector, and the human host",1
416,Understand how new genomic tools and molecular epidemiology approaches can improve decision-making to inform local and national malaria policymaking,2
416,Explore the impact of drug and insecticide resistance on malaria control and eradication programs and advances in vaccine and drug development,3
416,Apply modern data science strategies to measure how well different malaria interventions work in different settings,4
416,Maximize the impact of available resources through enhanced targeting and improved efficiency of malaria interventions,5
416,Incorporate core principles of adaptive surveillance systems to monitor and respond to malaria for the purpose of disease elimination and attainment of malaria-free status,6
416,"Understand the historical, political, behavioral, and socio-economic contexts of malaria control, elimination, and eradication efforts",7
417,To understand how collective decisions are made with the use of economic concepts.,1
417,How the emergence of states in facilitating collective decisions have reduced incidences of violence and improved human welfare.,2
417,"How economic concepts can be applied to tackle problems and conflicts, for example, through well-defined property rights, use of rule-based methods, voting rules, etc.",3
417,The application of the theory of social choice to illuminate the liberal and populist interpretation of voting and the relationship with theories of liberty and democracy.,4
417,Learn how actual politics can be viewed as the use of heresthetics or the art of manipulation to achieve political objectives.,5
417,了解如何使用經濟概念作出集體決策。,6
417,國家的出現如何促進集體決策、減少暴力事件並改善了人類福祉。,7
417,如何應用經濟概念來解決問題和衝突，例如，通過明確的產權，使用基於規則的方法，投票規則等。,8
417,應用社會選擇理論來闡明自由主義和民粹主義對投票的解釋以及與自由和民主理論的關係。,9
417,了解如何將實際政治視為使用美學或操縱藝術來實現政治目標。,10
418,"How to adopt the 5 practices of Agile, a subset of DevOps: small batches, minimum viable product, pair programming, behavior- and test-driven development.",1
418,How to create and refine a product backlog using the sprint planning process. Produce potentially shippable product increments with every iteration.,2
418,"How to write good user stories, estimate and assign story points and track stories using a kanban board. Incorporate Scrum artifacts, events, and benefits.",3
418,"How to create burndown charts to forecast the ability to meet a sprint goal. Use metrics to enhance performance, productivity, and client satisfaction.",4
422,The diversity of Jews and Judaism,1
422,Key facts about the primary texts of the Jewish canon,2
422,The role that scripture has played and continues to play in the lives of Jews,3
422,Why the sacred texts of Judaism continue to matter in the 21st century,4
423,How to use spreadsheet applications like Microsoft Excel to execute basic analyses,1
423,How to determine the most appropriate Excel functions for different tasks,2
423,How to calculate and analyze market size and market share,3
423,How to visualize and communicate data with charts and graphs,4
423,How to critically read visualized data,5
423,"How to communicate different types of revenue, cost, and key profitability metrics",6
424,"how to protect the atmosphere with the technology of Carbon Capture and Storage, often called CCS, from an excess of carbon dioxide",1
424,the fundamental drivers to make fossil fuels ‘safe to use’ in the context of the Paris Climate Change agreement of 2015,2
424,key sectors of the global economy where CCS can contribute to deep reductions in emissions,3
424,the uniqueness of CCS to complement other low-carbon technologies,4
424,"how CCS can unlock carbon negative solutions, which will need to be used before mid-century",5
424,"the principles of the technologies currently used to stop carbon dioxide from entering the atmosphere,",6
424,"the key elements of geology for permanently, and safely, disposing of carbon dioxide underground",7
424,the international state of play today,8
424,the scale of the industry in the 21st century,9
427,Basic principles of environmental protection,1
427,Biodiversity conservation practices,2
427,Solutions for water and air pollution challenges,3
427,Major opportunities for sustainability,4
427,How human development can be sustainable,5
428,An introduction to the concept of value,1
428,Value and willingness-to-pay,2
428,The marketing research process,3
428,Estimating willingness-to-pay using auctions,4
428,Elements of quantitative survey design,5
428,Segmentation using cluster analysis,6
428,Ethical issues in marketing research,7
429,"Gain a solid understanding of core concepts of SWM, with a focus on municipal solid waste (MSW), and the importance of the sector on economic development and environmental protection",1
429,"Evaluate various technology options based on the financial, technical, and operational capacities of each technology and treatment/disposal options",2
429,"Distinguish between infrastructure (capex) and operations and maintenance (opex) costs, as related to various technologies, and gain insight into cost recovery methods; learn about various funding mechanisms to establish SMW projects",3
429,Examine various policy options at national and local levels to determine what would be most suitable given individual country and city scenarios and learn how institutions and coordination can improve service delivery and financial performance of the sector,4
429,"Gain awareness of technological innovations in the sector, the key role of informal workers and women (particularly in low- and middle-income countries), and the changing perceptions of the waste sector towards resource management",5
429,"Familiarize and apply solutions for improvement in the sector, while learning from practical examples and case studies",6
431,Understand current issues facing journalists globally,1
431,Improve your English vocabulary and grammar in order to write more effective stories,2
431,Communicate more effectively with others in interviews and reports,3
431,"Understand issues of ethics, equality, and fairness as they apply to journalism",4
436,CS50's Introduction to Computer ScienceHarvardX,1
436,Course,2
436,Artificial Intelligence: Implications for Business StrategyMIT Sloan School of Management,3
436,Executive Education,4
436,Supply Chain DesignMITx,5
436,Course,6
436,Data Structures & Algorithms IVGTx,7
436,Course,8
436,Exercising Leadership: Foundational PrinciplesHarvardX,9
436,Course,10
436,digital forensics,11
436,EC-Council: Digital Forensics Essentials (DFE),12
436,Increase your career opportunities84% of learners report more opportunities after earning their certificate.,13
436,Show off your hard work and dedicationYou’re learning fromEC-Council! That’s a big deal. Let others know about your achievements.,14
436,Unlimited Access,15
436,World class institutions,16
436,Graded assessments,17
436,Earn a certificate,18
436,Access Expires May 27,19
436,Learn Software Engineering,20
437,basic principles established in a way that allows readers from different disciplinary backgrounds to understand the key concepts,1
437,key practical issues such as:prediction of pore pressureestimation of hydrocarbon column heights and fault seal potentialdetermination of optimally stable well trajectoriescasing set points and mud weightschanges in reservoir performance during depletionproduction-induced faulting and subsidence,2
437,prediction of pore pressure,3
437,estimation of hydrocarbon column heights and fault seal potential,4
437,determination of optimally stable well trajectories,5
437,casing set points and mud weights,6
437,changes in reservoir performance during depletion,7
437,production-induced faulting and subsidence,8
438,"Describe the benefits of implementing AI in organizations, in terms of context, problems, research approach and results.",1
438,"Identify the implications of implementing AI in terms of improvement strategies for organizations in industry, academia and education.",2
438,Understand the aspects of AI compliance and ethics and their significance for your own organization.,3
438,"Write about the implications of AI for industry, academia, education, or compliance and ethics.",4
440,Develop mature Java programming skills by using recursion in Tree ADTs,1
440,"Investigate different nonlinear, linked data structures: Trees, Heaps, SkipLists and HashMaps",2
440,Study the significant uses and applications of hierarchical tree structures,3
440,"Explore tree properties, and categorizing based on shape and order",4
440,Design and implement the binary trees: BSTs and Heaps,5
440,Examine edge cases and efficiencies in BST and Heap operations,6
440,"Understand the up-heap, down-heap and build-heap procedures",7
440,"Consider the probabilistic data structure, SkipLists, and randomization",8
440,Implement a HashMap ADT with its key-value pairs,9
440,Analyze the different collision strategies with HashMaps,10
440,Compute amortized analysis for Heaps and HashMaps,11
442,How to build amplifiers using MOSFETs,1
442,How to use intuition to describe the approximate time and frequency behavior of first-order circuits containing energy storage elements like capacitors and inductors,2
442,The relationship between the mathematical representation of first-order circuit behavior and corresponding real-life effects,3
442,How to improve the speed of digital circuits,4
442,"Measurement of circuit variables using tools such as virtual oscilloscopes, virtual multimeters, and virtual signal generators",5
442,How to compare the measurements with the behavior predicted by mathematical models and explain the discrepancies,6
444,The meaning and application of CRM,1
444,Benefits of CRM to companies and consumers,2
444,How to implement CRM best practices,3
444,The importance of bonding and building loyalty with customers,4
444,How to build long term customer realtionships,5
446,Introduction to Risk Management and Credit Principles,1
446,Principles of Corporate and Project Finance,2
446,"Credit Markets, Loan Defaults, and Expected Loss",3
446,"Business, Industry, and Company Risk",4
446,Ratings Agencies and Financial Disclosure,5
447,The basics of the Sustainable Development Goals,1
447,"The role of people: from inequality, to poverty, to health and human rights",2
447,"The role of the planet: planetary boundaries, the value of renewable energy, and sustainable consumption of our natural resources",3
447,"How to help nations, businesses and economies flourish without leaving anyone behind",4
448,"ICT can improve access to knowledge and services, promote transparency, and encourage collaboration",1
448,"Responsible collection and use of data requires governance, security, and trust",2
448,ICT projects should be contextualized and inclusive,3
448,Technology isnotneutral! Be aware of bias in design and implementation,4
450,CS50's Introduction to Computer ScienceHarvardX,1
450,Course,2
450,Artificial Intelligence: Implications for Business StrategyMIT Sloan School of Management,3
450,Executive Education,4
450,Supply Chain DesignMITx,5
450,Course,6
450,Data Structures & Algorithms IVGTx,7
450,Course,8
450,Exercising Leadership: Foundational PrinciplesHarvardX,9
450,Course,10
450,HKPolyUx: Cantonese Language and Culture for Beginners,11
450,Increase your career opportunities84% of learners report more opportunities after earning their certificate.,12
450,Show off your hard work and dedicationYou’re learning fromHKPolyUx! That’s a big deal. Let others know about your achievements.,13
450,Unlimited Access,14
450,World class institutions,15
450,Graded assessments,16
450,Earn a certificate,17
450,Access Expires Jun 17,18
450,Learn Software Engineering,19
450,Learn Blockchain,20
451,Describe what a Linux distribution is and differentiate between common Linux distributions,1
451,Define what a shell is and recall common shell commands,2
451,Execute commonlinux commands and use pipes and filters,3
451,Outline what a script is and describe the ‘shebang’ interpreter directive,4
451,Create simple to intermediate level Bash shell scripts,5
451,Schedule cron jobs with crontab and describe the cron syntax,6
453,"Basic project management concepts and techniques, within international standards",1
453,Widely tested tools and techniques that facilitate good communication within a project,2
453,How to identify success factors in government projects and social projects,3
457,"How stress can impair our performance and well-being at work, and harm organizations",1
457,"The differences between healthy and toxic stress, and how to leverage healthy stress for success",2
457,"The benefits of mindfulness for helping you build resilience to stress, as well as innovation and team spirit at work",3
457,Research-based strategies for cultivating mindfulness within yourself and your organization,4
458,Explain the need for sustainable innovation and how biotechnology and biobased production can contribute to this,1
458,Describe the global context of biobased production,2
458,"Map the biobased economy, from research to application and from raw materials to products",3
458,Solve basic level calculations in bioprocess engineering,4
458,Integrate scientific and technological knowledge on the use of bioprocesses for industrial products at the cell and process level,5
458,Develop and assess the conditions for efficient and sustainable design of bioprocesses,6
458,Perform undergraduate engineering level calculations in bioprocess engineering,7
459,The foundation of effective communication within the health sector.,1
459,The science behind communication.,2
459,The impact of effective health communication and the implications of ineffective health communication.,3
459,Relationship-centered communication and listening preferences.,4
459,Role play and improvisation as tools for enhanced communication.,5
460,"How the U.S. health care system is organized, financed, and governed",1
460,"How to give examples of key system stakeholders and participants, public and private",2
460,"How to describe the U.S. health care system's essential building blocks, including Medicare, Medicaid, private health insurance, medical care delivery, pharmaceuticals, long-term care, mental health, oral health, and public health",3
460,Interpret contemporary policy controversies pertaining to each key U.S. health care system building block,4
460,Understand the basic components of the Affordable Care Act,5
460,Identify challenges associated with reforming the U.S. health care system,6
462,How to define climate change risks into distinct categories,1
462,An introduction to climate change risk management,2
462,Concepts of physical risks (eg. stranded assets) and transition risks (eg. renewable energy technology developments),3
462,Emerging trends in the transition towards climate-resilient investing,4
462,Ways of thinking about potential winners and losers in a lower carbon economy,5
462,Sources of financing emerging within the private sector for new investments,6
463,Evaluate and communicate the various sensory attributes of wine using formal descriptive language,1
463,"Explain the structure, growth and development of grapevines and objectives of different vineyard management practices",2
463,Contrast the different winemaking techniques employed in the production of different styles of wine,3
464,Define the cloud and how it works,1
464,Differentiate between cloud computing and deployment models,2
464,Explain the benefits of the AWS Cloud,3
464,Describe the basic global infrastructure of the cloud,4
464,Compare the different methods of interacting with AWS,5
464,Describe and differentiate between AWS service domains,6
464,Identify an appropriate solution using AWS Cloud services with various use cases,7
464,Describe the Well-Architected Framework,8
464,Explain the Shared Responsibility model,9
464,Describe security services with the AWS Cloud,10
464,Understand how an AWS Cloud migration strategy can help you meet your business objectives,11
464,Articulate the financial benefits of the AWS Cloud for an organization’s cost management,12
464,"Define the billing, account management, and pricing models",13
464,Understand how to use pricing tools to make cost-effective choices for AWS services,14
464,Understand how to prepare for the AWS Certified Cloud Practitioner exam,15
465,Colloquial Mandarin vocabulary used in daily life,1
465,Highly practical expressions in given Mandarin contexts,2
465,Listening skills for communicating with Chinese native speakers,3
465,Some basic and frequently used Chinese characters,4
465,How to utilize the course for self-study,5
466,How primary financial statements are constructed and what types of information is captured in each statement,1
466,How cash and profits can differ and how to use that information to effectively manage growth,2
466,How to calculate key performance ratios and use those metrics to evaluate the performance of your business,3
466,How to create a financial forecast that you can use to better manage your business and to present to potential investors and creditors,4
467,Operation principle of electric cars,1
467,Motors and power electronics in an electric car,2
467,Battery technology,3
467,"Relevant charging infrastructure technologies and innovations, such as smart charging",4
467,Future technology for EVs such as wireless charging and solar EVs,5
470,The foundations of people metrics and analytics.,1
470,How to apply the HR measurement cycle.,2
470,How to integrate people metrics into HR practices.,3
470,How to apply statistical techniques to provide people analytics.,4
470,Internal and external HR reporting using people metrics and analytics.,5
472,Fundamental laws of mechanics and orbital mechanics,1
472,Orbital maneuvers,2
472,Types of space missions and their objectives,3
472,Space environment,4
472,General concepts of space vehicle architecture,5
472,Propulsion,6
472,Attitude determination and control,7
472,Onboard systems,8
472,Risk management and reliability,9
472,"Key design elements for successful missions, in particular related to human spaceflight",10
473,CS50's Introduction to Computer ScienceHarvardX,1
473,Course,2
473,Artificial Intelligence: Implications for Business StrategyMIT Sloan School of Management,3
473,Executive Education,4
473,Supply Chain DesignMITx,5
473,Course,6
473,Data Structures & Algorithms IVGTx,7
473,Course,8
473,Exercising Leadership: Foundational PrinciplesHarvardX,9
473,Course,10
473,biomedical sciences,11
473,IsraelX: Essentials of Genomics and Biomedical Informatics,12
473,Increase your career opportunities84% of learners report more opportunities after earning their certificate.,13
473,Show off your hard work and dedicationYou’re learning fromIsraelX! That’s a big deal. Let others know about your achievements.,14
473,"Next Generation Sequencing, and in particular, the ability to sequence individual genomes at diminishing costs.",15
473,"Electronic Medical Records, and our ability to mine, using machine learning techniques, huge datasets of medical records.",16
473,"Wearable devices, the Web, social networks and crowdsourcing - exemplifying the surprising capacity to collect medical data using non-conventional resources.",17
473,Unlimited Access,18
473,World class institutions,19
473,Graded assessments,20
477,Principles of atmospheric science,1
477,Climate data collection and interpretation,2
477,Zero-dimensional Energy Balance Models,3
477,One-dimensional Energy Balanced Models,4
477,General Circulation Models,5
477,Carbon emissions scenarios,6
477,Future climate change projections,7
477,Impacts on human systems,8
477,Emissions reduction pathways,9
479,Accounting Concepts,1
479,Measuring Income,2
479,Recording Transactions,3
484,How to use a relational database,1
484,How to query data and shape results,2
484,How to write advanced queries and analytic functions,3
484,How to create and modify data in tables,4
486,Tools for how to interpret the roles religions play in contemporary conflicts;,1
486,How religions are internally diverse;,2
486,How religions evolve and change;,3
486,How religions are embedded in all human cultures;,4
488,Basic selection of CSS properties,1
488,Fundamental CSS selectors,2
488,Designing page layout through relative positioning with CSS,3
488,Best practices in Web design,4
489,To gain an understanding of the brain structures involved in decision-making and how they develop.,1
489,To gain an understanding of the neural mechanisms of decision-making processes and how these are influenced.,2
489,To gain an understanding of decision-making deficits and their role in psychological disorders.,3
489,To identify the key anatomical and physiological components of decision making from a neuropsychological perspective.,4
489,"To explain decision-making development in terms of executive function, the role of the prefrontal cortex and influences on development.",5
489,To outline decision-making deficits and roles of decision-making in psychological disorders,6
490,How to write a Web page,1
490,Concepts of a markup language,2
490,Basics of HTML5 and CSS,3
490,Web design and style,4
490,Page layout and flexbox,5
491,Basic knowledge on algorithms and Java programming,1
491,Develop programs with conditionals and loops,2
491,Design and implement recursive algorithms,3
491,Understand basic mechanisms of the OOP paradigm,4
491,Use and interpret the API of some of the most common Java classes,5
491,Develop simple programs in Java,6
493,"The history of blockchain technology, the evolution of digital money and the motivation for decentralized systems",1
493,Concepts of Cryptography and Hashing in the context of blockchains,2
493,Using Crypto wallets and Blockchain explorers,3
493,The security implications and limitations of Blockchain networks,4
493,The key differences between Proof of Work (PoW) and Proof of Stake (PoS),5
493,The advantages and disadvantages of the distributed consensus mechanisms,6
493,The different Blockchain nodes that help sustain a decentralized network,7
493,"Layer 0, Layer 1 and Layer 2 Blockchains and their key applications",8
493,"The technology powering Cryptocurrencies, Decentralized Finance (DeFi), NFTs and DAOs",9
493,The future prospects of Blockchain technology and Web3,10
495,Understand what creative thinking techniques are,1
495,Comprehend their importance in tackling global challenges as well as in everydayproblem-solving scenarios,2
495,Apply different brainstorming techniques in groupactivities,3
495,Be proficient in the application of the 6 thinking hats tool in different life scenarios,4
495,Develop a systematic approach to idea generation through the use of morphological analysis,5
495,"Innovate on an existing product, service or situation applying the SCAMPER method",6
495,"Get confident with the theory of inventive problem solving, called TRIZ",7
495,Select and apply the appropriate technique based on the opportunity to seize or the problem to tackle,8
496,"Qué es un programa y por qué merece la pena aprender a programar, las ventajas del lenguaje Python, cómo instalarlo y cómo utilizarlo",1
496,"La plataforma Anaconda, los Jupyter Labs y el entorno de desarrollo Spyder",2
496,"Las variables, expresiones y operadores lógicos en Python",3
496,"Las distintas formas de ejecución de un programa, secuencial, condicional e iterativa y los comandos Python para implementarlas: if, for y while",4
496,"Las funciones como herramienta para reutilizar código y su extensión, los módulos y los paquetes",5
496,Como trabajar con cadenas de texto en Python y qué son los códigos de caracteres,6
496,Como leer y escribir en ficheros de texto en Python y manejar de forma adecuada los códigos de caracteres,7
500,CS50's Introduction to Computer ScienceHarvardX,1
500,Course,2
500,Artificial Intelligence: Implications for Business StrategyMIT Sloan School of Management,3
500,Executive Education,4
500,Supply Chain DesignMITx,5
500,Course,6
500,Data Structures & Algorithms IVGTx,7
500,Course,8
500,Exercising Leadership: Foundational PrinciplesHarvardX,9
500,Course,10
500,WBGx: Introduction to Public Expenditure and Financial Accountability (PEFA),11
500,Increase your career opportunities84% of learners report more opportunities after earning their certificate.,12
500,Show off your hard work and dedicationYou’re learning fromWBGx! That’s a big deal. Let others know about your achievements.,13
500,Unlimited Access,14
500,World class institutions,15
500,Graded assessments,16
500,Earn a certificate,17
500,Access Expires Jun 3,18
500,Learn Software Engineering,19
500,Learn Blockchain,20
505,Learn how influence works within organizations and industries,1
505,Understand your clients and learn to use emotions as a driver of their decision-making,2
505,Discover the tools to make your marketing and communication more efficient,3
