course_id,subject,order_index
1,Learn Software Engineering,1
1,Learn Blockchain,2
1,Learn Computer Programming,3
1,Learn Architecture,4
1,Learn Project Management,5
1,Learn Business Administration,6
1,Become a Cybersecurity Analyst,7
1,Become a Data Scientist,8
1,Become a Social Media Manager,9
1,Become a Software Developer,10
1,Become a Software Engineer,11
1,Bachelor's in Business,12
1,Bachelor's in Computer Science / Data Science,13
1,Bachelor's in Health and Nursing,14
1,Bachelor's in Accounting,15
2,"A theoretical background of contracts, trust, and promise",1
2,How to form contracts through valid offer and acceptance,2
2,Limits to enforcing contracts,3
2,Issues excusing contractual performance,4
2,Available remedies for contractual breaches,5
2,Third parties' ability to enforce contracts,6
2,The limitations of contract law,7
2,How courts interpret contracts,8
2,"Relationship of Contracts to Agency, Partnership, Corporations and Regulation",9
2,How to read through contracts to apply these key concepts and understand potential issues and outcomes,10
3,CREATE TABLE,1
3,CREATE INDEX,2
3,CREATE VIEW,3
3,"SQLite, PostgreSQL, MySQL",4
3,"connectors (Python, Java)",5
3,replication,6
4,The fundamentals of political philosophy,1
4,"An understanding of social justice and criminal justice, and the roles they play in the modern justice system",2
4,"A deeper sense of the philosophy that underlies modern issues such as affirmative action, same sex marriage, and equality",3
4,The ability to better articulate and evaluate philosophical arguments and ask philosophical questions,4
5,Explore diverse definitions of happiness and understand its function in everyday life,1
5,"Learn how genetic, social, and economic influences impact your happiness",2
5,"Apply the science of the mind, body, psychology, and community to manage emotions and behaviors for greater happiness",3
5,Develop a happiness portfolio focused on your deepest goals and desires,4
5,Recognize how success and achievement impact short versus long-term happiness,5
5,Write your ending — build happiness strategies for your work and life at any age or stage,6
6,How to identify and unbundle complex challenges,1
6,How to understand the role of formal and informal authority,2
6,How to identify the key perspectives of stakeholders,3
6,How to build and renew trust relationships,4
6,How to approach conflict,5
6,How to implement personal strategies for surviving and thriving amidst change,6
7,Gain hands-on experience and practice using Python to solve real data science challenges,1
7,"Practice Python programming and coding for modeling, statistics, and storytelling",2
7,"Utilize popular libraries such as Pandas, numPy, matplotlib, and SKLearn",3
7,"Run basic machine learning models using Python, evaluate how those models are performing, and apply those models to real-world problems",4
7,"Build a foundation for the use of Python in machine learning and artificial intelligence, preparing you for future Python study",5
9,What happiness really means and why it matters to you,1
9,How to increase your own happiness and foster happiness in others,2
9,"Why social connections, kindness, and community are key to happiness",3
9,Which mental habits are most conducive to happiness and how mindfulness can help,4
10,Basic R syntax,1
10,"Foundational R programming concepts such as data types, vectors arithmetic, and indexing",2
10,"How to perform operations in R including sorting, data wrangling using dplyr, and making plots",3
11,Fundamentals of bioelectricity,1
11,The importance of resting potential,2
11,The properties of passive membranes,3
11,"Action potentials, their currents, and their role in the nervous system",4
11,How you can do neuroscience in your home,5
12,Gain perspective on how scientifically-proven skills can improve your resilience and mental health,1
12,Build a toolkit of five core skills to help you manage emotional stress and apply them to different situations,2
12,Improve your ability to face fears and anxieties by preparing your own plan for handling stressful scenarios,3
13,"HTML, CSS",1
13,"SQL, Models, and Migrations",2
13,JavaScript,3
13,User Interfaces,4
13,"Testing, CI/CD",5
13,Scalability and Security,6
15,"hacking, cracking",1
15,"social engineering, phishing attacks",2
15,"passcodes, passwords, SSO",3
15,"brute-force attacks, dictionary attacks",4
15,biometrics,5
15,"multi-factor authentication, password managers",6
15,ethical hacking,7
15,(distributed) denial-of-service attacks,8
15,"viruses, worms, botnets",9
15,SQL injection attacks,10
15,port-scanning,11
15,"proxies, firewalls",12
15,automatic updates,13
15,"closed-source, open-source software",14
15,buffer-overflow attacks,15
17,Learn about the IELTS test procedure and format,1
17,Learn useful test-taking strategies and skills for the IELTS Academic tests,2
17,"Develop your English reading, writing, listening and speaking skills",3
18,graph search algorithms,1
18,adversarial search,2
18,knowledge representation,3
18,logical inference,4
18,probability theory,5
18,Bayesian networks,6
18,Markov models,7
18,constraint satisfaction,8
18,machine learning,9
18,reinforcement learning,10
18,neural networks,11
18,natural language processing,12
21,"Functions, Variables",1
21,Conditionals,2
21,Exceptions,3
21,Libraries,4
21,Unit Tests,5
21,Regular Expressions,6
21,Object-Oriented Programming,7
21,Et Cetera,8
22,A broad and robust understanding of computer science and programming,1
22,How to think algorithmically and solve programming problems efficiently,2
22,"Concepts like abstraction, algorithms, data structures, encapsulation, resource management, security, software engineering, and web development",3
22,"Familiarity in a number of languages, including C, Python, SQL, and JavaScript plus CSS and HTML",4
22,How to engage with a vibrant community of like-minded learners from all levels of experience,5
22,How to develop and present a final programming project to your peers,6
24,"History, benefits, and foundational concepts of online learning",1
24,How to leverage your prior educational experiences for success learning online,2
24,"Technology fundamentals for online learning, including building your digital confidence, using an LMS (Learning Management System), and making the most of online accessibility features",3
24,"Study strategies for online learning, anchored in the ABCDs: Awareness, Balance, Community, and Dedication",4
24,Time management skills to help integrate learning into your busy life,5
27,The origins of child protection in international human rights law,1
27,How to analyze global child protection issues and the diversity of actors involved in child protection,2
27,"The impact of violence, exploitation, and abuse (VEA) on children’s emotional, social and physical development and strategies for preventing and responding to these harms",3
27,The standards of protection for children in conflict or in contact with the law,4
27,How to assess and strengthen a child protection system,5
31,The structure and function of the chemical building blocks of life,1
31,How to navigate protein structures using PyMOL,2
31,The central role of enzymes in catalyzing the reactions of life,3
31,The primary metabolic pathways that power cells,4
31,The intricate mechanisms that regulate cellular metabolism,5
31,"The integration of biochemical processes in the context of cells, tissues, and whole organisms",6
32,Data visualization principles,1
32,How to communicate data-drivenfindings,2
32,How to use ggplot2 to create custom plots,3
32,The weaknesses of several widely-used plots and why you should avoid them,4
33,"How to read, analyze, and understand different forms of architectural representation",1
33,Social and historical contexts behind major works of architecture,2
33,Basic principles to produce your own architectural drawings and models,3
33,Pertinent content for academic study or a professional career as an architect,4
34,"The origin, architecture, primary components, and building blocks of Kubernetes",1
34,How to set up and access a Kubernetes cluster using Minikube,2
34,Ways to run applications on the deployed Kubernetes environment and access the deployed applications,3
34,Usefulness of Kubernetes communities and how you can participate.,4
35,How to reliably identify the roles and relationships of words in a sentence,1
35,Mastery of grammatical concepts and syntactical strategies,2
35,"How to apply this knowledge to produce coherent, economical, and compelling writing",3
35,Skills in critiquing and editing your own and others' writing,4
37,Model uncertainty in supply chains using probability and statistical analysis,1
37,Conduct hypothesis testing and regression analysis to support data-driven decisions,2
37,Formulate and solve mathematical optimization models for supply chain planning and network design,3
37,"Use simulation techniques to evaluate policies, test scenarios, and assess decisions under uncertainty",4
37,Apply algorithmic and approximation methods to solve complex problems when exact solutions are computationally infeasible,5
38,Probability distributions in finance,1
38,"Time-series models: random walks, ARMA, and GARCH",2
38,Continuous-time stochastic processes,3
38,Optimization,4
38,Linear algebra of asset pricing,5
38,Statistical and econometric analysis,6
38,Monte Carlo simulation,7
38,Applied computational techniques,8
41,How to think about uncertainty and randomness,1
41,How to make good predictions,2
41,The story approach to understanding random variables,3
41,Common probability distributions used in statistics and data science,4
41,Methods for finding the expected value of a random quantity,5
41,How to use conditional probability to approach complicated problems,6
42,An awareness of the opportunities for entrepreneurship in fast-growing emerging markets,1
42,An understanding of a conceptual framework for evaluating such opportunities,2
42,An appreciation of the types of problems that lend themselves to entrepreneurial solutions,3
43,Review fundamentals of spreadsheet applications,1
43,Perform basic spreadsheet tasks,2
43,Explain the importance of data quality,3
43,Import file data into Excel,4
43,Filter and sort data,5
43,Clean and prepare data,6
43,Analyze data using an Excel spreadsheet,7
44,How to value any asset,1
44,Decide which projects to take out of the many a corporation might be considering,2
44,Compute the return on any project,3
44,Compute the value that a project adds,4
44,Value a bond and compute its yield,5
44,"Value a stock using a simple model (i.e., determine the fair price of a stock)",6
45,Learn Python - the most popular programming language and easy to learn for beginners,1
45,Develop fundamental Python skills for Data Science and Software Development,2
45,Work with commonly used Python libraries such as Pandas and Numpy,3
45,"Utilize Jupyter Notebooks to develop, experiment with and execute Python code",4
45,Access and webscrape data using APIs and libraries like Beautiful Soup,5
48,Basic conversational skills,1
48,The alphabet and numbers,2
48,"How to describe your nationality, your likes, and your family",3
48,Using the verbto be; Basic conjugation,4
50,Understand what the Data Wise Improvement Process is and how it can help you improve teaching and learning,1
50,"Build skills in looking at a wide range of data sources, including test scores, student work, and teaching practice",2
50,Identify next steps in supporting a culture of collaborative data inquiry in your setting,3
51,An introduction to the history and key debates in Psychology and Neuropsychology exploring the main different cognitive functions and how they interact with one another.,1
51,The key techniques and methods to study the mind.,2
51,"The main theories, models and concepts of attention, memory, language, perception and emotional processing",3
52,The foundations of the American political culture,1
52,How the Constitution represented the idea of “limited government”,2
52,Why the Constitution’s framers felt it necessary to limit popular influence,3
52,The history of federalism as a constitutional issue,4
52,How power is divided between the federal and state governments,5
52,What individual rights are held by today’s Americans,6
52,Which policies have expanded the rights of disadvantaged groups,7
53,How religion and politics have been a persistent source of conflict,1
53,The nature of U.S. fiscal policy and monetary policy,2
53,How America’s welfare policies are distinct from those of other Western democracies,3
53,The structure and politics of the U.S. tax system,4
53,The partisan divisions over regulatory policy and the basis for those divisions,5
53,The factors that made America an economic powerhouse,6
55,"How the reproductive technology industry works, and issues raised related to buying and selling human reproductive materials",1
55,The law and ethics of surrogacy,2
55,Civil lawsuits when things go wrong with reproductive technology: wrongful birth and wrongful life lawsuits,3
55,The law and ethics of sperm donation and the legal status of sperm donors,4
55,Ethical and legal issues raised by human enhancement,5
55,The law and ethics of mixing human and animal genetic material,6
55,The ownership of human tissue and its underlying genetic information,7
56,Valuation of fixed income securities and common stocks,1
56,"Risk analysis, the Arbitrage Pricing Theory (APT), and the Efficient Market Hypothesis",2
56,Introduction to corporate finance and capital budgeting,3
56,Valuation of derivative securities,4
56,Portfolio theory and the Capital Asset Pricing Model (CAPM),5
56,"Corporate financial decisionsReal options, capital structure, payout policy, corporate bonds; andInteraction between investment and financing decisions",6
56,"Real options, capital structure, payout policy, corporate bonds; and",7
56,Interaction between investment and financing decisions,8
57,financial accounting,1
57,"NewExecutive EducationExpert-led, fully supported courses that build career-critical skills",2
57,NewMaster's DegreesOnline degree programs from top universities,3
57,NewBachelor's DegreesBegin or complete a degree; fully online,4
58,Authentic examples and case studies of how calculus is applied to problems in other fields,1
58,"How to analyze mathematical models, including variables, constants, and parameters",2
58,Appreciation for the assumptions and complications that go into modeling real world situations with mathematics,3
59,"The concepts necessary to define estimates and margins of errors of populations, parameters, estimates and standard errors in order to make predictions about data",1
59,How to use models to aggregatedata from different sources,2
59,The very basics of Bayesian statistics and predictive modeling,3
60,How to use Unix/Linux to manage your file system,1
60,How to perform version control with git,2
60,How to start a repository on GitHub,3
60,How to leverage the many useful features provided by RStudio,4
62,How to apply the knowledge base and skills learned throughout the series to a real-world problem,1
62,How to independently work on a data analysis project,2
63,Importing data into R fromdifferent file formats,1
63,Web scraping,2
63,How to tidy data using the tidyverse tobetter facilitateanalysis,3
63,String processing with regular expressions (regex),4
63,Wrangling data using dplyr,5
63,How to workwith dates and times as file formats,6
63,Text mining,7
64,The relationship between quality and population health,1
64,A framework for understanding and thinking about healthcare quality,2
64,Approaches to quality measurement,3
64,The role of information and communication technology in assessing and improving quality,4
64,Tools and contextual knowledge to improve the quality delivered in health systems,5
65,A good working knowledge of Linux,1
65,How to navigate through major Linux distributions,2
65,System configurations and graphical interface of Linux,3
65,Basic command line operations,4
65,Common applications of Linux,5
66,The history of World Literature,1
66,How literary works and books are transformed by cultural transmission,2
66,How to critically analyze literary works,3
66,The significance of major technological advances in writing,4
67,How the internal structure and organization of a cell provides an understanding of how and why a cell works,1
67,The role mitochondria play in the cell and why it is important for a cell to make ATP,2
67,How cells metabolize food to provide the molecules necessary for mitochondrial function,3
67,How the structure of the F1F0 ATP synthase leads to the production of ATP,4
67,What experimental techniques are used to investigate mitochondrial structure and function in the laboratory,5
69,Random variables,1
69,Distributions,2
69,Inference: p-values and confidence intervals,3
69,Exploratory Data Analysis,4
69,Non-parametric statistics,5
71,Important concepts in probability theory including random variables and independence,1
71,How to perform a Monte Carlo simulation,2
71,The meaning of expected values and standard errors and how to compute them in R,3
71,The importance of the Central Limit Theorem,4
72,How a computer processes programming code,1
72,"The write-run-debug cycle of writing code, running it, and revising it based on its output.",2
72,"Procedural programming, or how to write sequential lines of code.",3
72,"Variables, their types, and their role in complex programs.",4
72,"Mathematical operators for arithmetic operations, exponents, and more.",5
72,Relational operators for evaluating relative values or set membership.,6
72,Boolean operators for resolving complex logical statements.,7
73,Python 3 programming basics (a review),1
73,"Python tools (e.g., NumPy and SciPy modules) for research applications",2
73,How to apply Python research tools in practical settings,3
74,"The basic engineering, environmental science, and economics of our energy system.",1
74,Aworking understanding of energy technologies.,2
74,"Environmental impacts of the energy system, focusing on air pollution, climate change, and land use.",3
74,Techniques for estimating monetary costs andcarbon impacts.,4
75,The cultural significance of Shakespeare's plays and their performance,1
75,"How Shakespeare’s work was considered in his own time and in the present, in his own country and around the world",2
75,Different approaches to textual interpretation,3
75,"How to consider authorial intention, historical context, and present relevance",4
75,How to analyze Shakespeare's plays on the page and in performance,5
75,Foundational knowledge on Shakespeare that can be applied to his specific works,6
76,Basics of synapses,1
76,How neurons communicate with each other,2
76,How interconnected neurons in neuronal circuits interact with each other,3
76,The role of neuromodulation in the firing of synapses,4
77,What the term “digital humanities” means in different disciplines.,1
77,How common digital tools work and examples of projects using them.,2
77,"How various file types can be used to create, gather, and organize data.",3
77,How to use command-line functions to analyze text.,4
77,How to use free tools to create visual text analysis.,5
78,"Understand the language of the stock market, with a working knowledge of key terms and phrases",1
78,"Employ key money management techniques, such as knowing when and how to use stop orders, establishing trading goals, and knowing when and how toenter into trades",2
78,"Learn the proper technical tools to use for charting, such as candlesticks, time frames and RSI’s",3
80,"Climate change's impacts on nutrition, migration, and infectious diseases",1
80,The research methods used in this field,2
80,Strategies to mitigate and adapt to the health impacts of climate change,3
80,How changes in Earth's atmosphere affect health outcomes,4
80,How to assess the various ways of addressing the health effects of global warming,5
81,Excel fundamentals.,1
81,Data entry and editing using various formats.,2
81,Performing calculations using formulas and functions.,3
81,How to format and optimize spreadsheets.,4
81,How to manage spreadsheets using Filter and sort table data capabilities.,5
81,Previewing and printing.,6
81,Effective data visualization using basic charts.,7
82,How linear regression was originally developed by Galton,1
82,What is confounding and how to detect it,2
82,How to examine the relationships between variables by implementing linear regression in R,3
83,"The role of air, water, and wind in weather systems",1
83,How to estimate local wind speed and direction,2
83,How to avoid being struck by lightning,3
83,How to identify cloud types and features,4
83,How to describe the attributes of thunderstorms and tornadoes,5
83,How to collect and interpret data and observations to predict the next day's weather,6
83,The benefits and drawbacks of weather prediction methods,7
83,The butterfly effect and its application to weather systems,8
85,"Describe the different forms of energy, such as mechanical (kinetic and potential), electrical, chemical, electromagnetic, thermal, and nuclear",1
85,Interpret the units of energy and power and how to convert between them,2
85,"Understand different subatomic particles (proton, electron, neutron) and the major experiments that led to the modern concept of the atom and its structure",3
85,Recognize the nature of a chemical bond and compare and contrast the different methods of representing the chemical bonds in a molecule,4
85,Explain the Second Law of Thermodynamics and apply it to chemical reactions,5
85,"Gain an understanding of enthalpy, water condensation, geothermal energy, and thermodynamic pressure",6
86,The early history of World Literature,1
86,How literary works are transformed by cultural transmission and modern recovery,2
86,How to critically analyze literary works,3
86,The significance of major technological advances in writing,4
88,A systematic approach to technology entrepreneurship,1
88,How to generate new use scenarios by matching customer needs with promising technology seeds,2
88,How to align business and operating models,3
88,How to evaluate a technology for readiness and market fit,4
88,How to position opportunities to secure funding,5
89,Understand why digital marketing matters today,1
89,Understand changes in the digital landscape,2
89,Learn how to create innovative and impactful content,3
89,Learn how to create and use consumer personas,4
89,Conduct a competitor audit and analysis,5
89,Develop your own digital marketing strategy,6
91,Describe the important role charts play in telling a data-driven story,1
91,Use Excel features to create charts and pivot charts,2
91,Create advanced charts and visualizations,3
91,Create a simple dashboard using an Excel spreadsheet,4
91,Create visualizations in Cognos Analytics,5
91,Build an interactive dashboard,6
99,"What’s in the Bible, the book containing the sacred scriptures of Christians.",1
99,An overview of contents with a focus on diverse interpretations of well-known passages.,2
99,"Exploration of select themes, such as how Christians approach diversity, attitudes toward non-Christian traditions, existential questions of suffering and violence, the encounter with modern science, the roles of women, liturgical time and pilgrimage.",3
100,The chemical and physical principles that underlie everyday cooking and haute cuisine techniques,1
100,How chefs can use enzymes to make foods that would otherwise be impossible,2
100,"How to use the scientific method to learn how a recipe works, and find ways you could improve it",3
100,How to think like a chef AND a scientist.,4
101,How to frame a global health problem with a biosocial perspective,1
101,How to use a toolkit of analytical approaches to examine global health initiatives so as to identify and implement effective interventions,2
101,How to evaluate the ethical frameworks that have underpinned engagement within global health,3
102,The recent history of World Literature,1
102,How literary works are transformed by cultural transmission,2
102,How to critically analyze literary works,3
102,"Historical and political context in China, Argentina, Turkey, and more",4
103,A conceptual understanding of quantum mechanics,1
103,Key physics concepts,2
103,Key ideas in using quantum mechanical waves,3
103,Mathematics of quantum mechanical waves,4
103,Quantum mechanics of systems that change in time,5
103,Measurements in quantum mechanics,6
103,The uncertainty principle,7
103,The hydrogen atom,8
103,How to solve real problems,9
104,How to translate expert knowledge into a causal diagram,1
104,How to draw causal diagrams under different assumptions,2
104,Using causal diagrams to identify common biases,3
104,Using causal diagrams to guide data analysis,4
105,How Congressmembers are influenced by their constituencies,1
105,What causes political polarization between Republicans and Democrats,2
105,How Congress’s structure limits progress on significant issues,3
105,How executive orders expand the powers of the presidency,4
105,Why presidents are less constrained in foreign policy than in domestic policy,5
105,How federal agencies promote and protect their programs,6
105,The influence of politics on Supreme Court decisions,7
106,The many ways ordinary people have created change,1
106,The centrality of women in American history,2
106,"How history is complex, nonlinear, and in constant conversation with the present",3
106,How objects can embody stories of change,4
106,How our understanding of history is shaped by which stories are told,5
107,Core concepts in community health as part of primary health systems,1
107,Key components in the design and optimization of community health worker programs as exemplified through country case studies,2
107,How to advocate for community health worker programs with key stakeholders,3
107,The evidence demonstrating the impact and returns of community health workers,4
